"No.","Time","Source","Destination","Protocol","Length","Info"
"1","0.000000000","80:56:f2:25:a0:91","ff:ff:ff:ff:ff:ff","ARP","60","Who has 192.168.0.1? Tell 192.168.0.4"
"2","0.005395090","6c:72:20:70:01:f8","80:56:f2:25:a0:91","ARP","60","192.168.0.1 is at 6c:72:20:70:01:f8"
"3","0.157754584","192.168.0.1","239.255.255.250","SSDP","307","NOTIFY * HTTP/1.1  "
"4","0.157769569","192.168.0.1","239.255.255.250","SSDP","316","NOTIFY * HTTP/1.1  "
"5","0.157772508","192.168.0.1","239.255.255.250","SSDP","379","NOTIFY * HTTP/1.1  "
"6","0.157775353","192.168.0.1","239.255.255.250","SSDP","371","NOTIFY * HTTP/1.1  "
"7","0.157777749","192.168.0.1","239.255.255.250","SSDP","316","NOTIFY * HTTP/1.1  "
"8","0.157780299","192.168.0.1","239.255.255.250","SSDP","355","NOTIFY * HTTP/1.1  "
"9","0.157783098","192.168.0.1","239.255.255.250","SSDP","387","NOTIFY * HTTP/1.1  "
"10","0.157785436","192.168.0.1","239.255.255.250","SSDP","316","NOTIFY * HTTP/1.1  "
"11","0.157788183","192.168.0.1","239.255.255.250","SSDP","375","NOTIFY * HTTP/1.1  "
"12","0.157791375","192.168.0.1","239.255.255.250","SSDP","381","NOTIFY * HTTP/1.1  "
"13","0.157794625","192.168.0.1","239.255.255.250","SSDP","369","NOTIFY * HTTP/1.1  "
"14","0.173699711","192.168.0.1","239.255.255.250","SSDP","375","NOTIFY * HTTP/1.1  "
"15","0.173707686","192.168.0.1","239.255.255.250","SSDP","303","NOTIFY * HTTP/1.1  "
"16","0.173709945","192.168.0.1","239.255.255.250","SSDP","312","NOTIFY * HTTP/1.1  "
"17","0.173711902","192.168.0.1","239.255.255.250","SSDP","367","NOTIFY * HTTP/1.1  "
"18","0.173713907","192.168.0.1","239.255.255.250","SSDP","377","NOTIFY * HTTP/1.1  "
"19","2.352309197","38:a4:ed:ed:84:5d","ff:ff:ff:ff:ff:ff","ARP","60","Who has 192.168.0.1? Tell 192.168.0.2"
"20","3.148851812","192.168.0.1","239.255.255.250","SSDP","307","NOTIFY * HTTP/1.1  "
"21","3.149206982","192.168.0.1","239.255.255.250","SSDP","316","NOTIFY * HTTP/1.1  "
"22","3.149843284","192.168.0.1","239.255.255.250","SSDP","379","NOTIFY * HTTP/1.1  "
"23","3.150777696","192.168.0.1","239.255.255.250","SSDP","371","NOTIFY * HTTP/1.1  "
"24","3.151188591","192.168.0.1","239.255.255.250","SSDP","316","NOTIFY * HTTP/1.1  "
"25","3.151841757","192.168.0.1","239.255.255.250","SSDP","355","NOTIFY * HTTP/1.1  "
"26","3.152317052","192.168.0.1","239.255.255.250","SSDP","387","NOTIFY * HTTP/1.1  "
"27","3.153056700","192.168.0.1","239.255.255.250","SSDP","316","NOTIFY * HTTP/1.1  "
"28","3.153741587","192.168.0.1","239.255.255.250","SSDP","375","NOTIFY * HTTP/1.1  "
"29","3.154193823","192.168.0.1","239.255.255.250","SSDP","381","NOTIFY * HTTP/1.1  "
"30","3.154920534","192.168.0.1","239.255.255.250","SSDP","369","NOTIFY * HTTP/1.1  "
"31","3.155569840","192.168.0.1","239.255.255.250","SSDP","375","NOTIFY * HTTP/1.1  "
"32","3.156187312","192.168.0.1","239.255.255.250","SSDP","303","NOTIFY * HTTP/1.1  "
"33","3.156861184","192.168.0.1","239.255.255.250","SSDP","312","NOTIFY * HTTP/1.1  "
"34","3.157451445","192.168.0.1","239.255.255.250","SSDP","367","NOTIFY * HTTP/1.1  "
"35","3.158162689","192.168.0.1","239.255.255.250","SSDP","377","NOTIFY * HTTP/1.1  "
"36","8.954509013","fe80::d899:567a:20b4:4cd0","ff02::c","SSDP","208","M-SEARCH * HTTP/1.1 "
"37","8.955864613","fe80::d899:567a:20b4:4cd0","ff02::1:ff46:84df","ICMPv6","86","Neighbor Solicitation for fe80::6c60:9741:b346:84df from 80:56:f2:25:a0:91"
"38","9.709725821","fe80::d899:567a:20b4:4cd0","ff02::1:ff46:84df","ICMPv6","86","Neighbor Solicitation for fe80::6c60:9741:b346:84df from 80:56:f2:25:a0:91"
"39","10.104752684","80:56:f2:25:a0:91","ff:ff:ff:ff:ff:ff","ARP","60","Who has 192.168.0.1? Tell 192.168.0.4"
"40","10.106832911","6c:72:20:70:01:f8","80:56:f2:25:a0:91","ARP","60","192.168.0.1 is at 6c:72:20:70:01:f8"
"41","10.710922135","fe80::d899:567a:20b4:4cd0","ff02::1:ff46:84df","ICMPv6","86","Neighbor Solicitation for fe80::6c60:9741:b346:84df from 80:56:f2:25:a0:91"
"42","11.956706995","fe80::d899:567a:20b4:4cd0","ff02::c","SSDP","208","M-SEARCH * HTTP/1.1 "
"43","14.958941584","fe80::d899:567a:20b4:4cd0","ff02::c","SSDP","208","M-SEARCH * HTTP/1.1 "
"44","20.173195462","80:56:f2:25:a0:91","ff:ff:ff:ff:ff:ff","ARP","60","Who has 192.168.0.1? Tell 192.168.0.4"
"45","20.175216830","6c:72:20:70:01:f8","80:56:f2:25:a0:91","ARP","60","192.168.0.1 is at 6c:72:20:70:01:f8"
"46","27.314111433","192.168.0.1","224.0.0.1","IGMPv2","60","Membership Query, general"
"47","27.964942669","38:a4:ed:ed:84:5d","ff:ff:ff:ff:ff:ff","ARP","60","Who has 192.168.0.1? Tell 192.168.0.2"
"48","30.334880496","80:56:f2:25:a0:91","ff:ff:ff:ff:ff:ff","ARP","60","Who has 192.168.0.1? Tell 192.168.0.4"
"49","30.336993635","6c:72:20:70:01:f8","80:56:f2:25:a0:91","ARP","60","192.168.0.1 is at 6c:72:20:70:01:f8"
"50","31.222532839","192.168.0.4","239.255.255.250","IGMPv2","60","Membership Report group 239.255.255.250"
"51","33.118784697","192.168.0.1","239.255.255.250","SSDP","307","NOTIFY * HTTP/1.1  "
"52","33.118803678","192.168.0.1","239.255.255.250","SSDP","316","NOTIFY * HTTP/1.1  "
"53","33.119354985","192.168.0.1","239.255.255.250","SSDP","379","NOTIFY * HTTP/1.1  "
"54","33.120006503","192.168.0.1","239.255.255.250","SSDP","371","NOTIFY * HTTP/1.1  "
"55","33.121211599","192.168.0.1","239.255.255.250","SSDP","316","NOTIFY * HTTP/1.1  "
"56","33.128305940","192.168.0.1","239.255.255.250","SSDP","355","NOTIFY * HTTP/1.1  "
"57","33.128312121","192.168.0.1","239.255.255.250","SSDP","387","NOTIFY * HTTP/1.1  "
"58","33.128314799","192.168.0.1","239.255.255.250","SSDP","316","NOTIFY * HTTP/1.1  "
"59","33.128317152","192.168.0.1","239.255.255.250","SSDP","375","NOTIFY * HTTP/1.1  "
"60","33.128319601","192.168.0.1","239.255.255.250","SSDP","381","NOTIFY * HTTP/1.1  "
"61","33.128322024","192.168.0.1","239.255.255.250","SSDP","369","NOTIFY * HTTP/1.1  "
"62","33.128324138","192.168.0.1","239.255.255.250","SSDP","375","NOTIFY * HTTP/1.1  "
"63","33.128328819","192.168.0.1","239.255.255.250","SSDP","303","NOTIFY * HTTP/1.1  "
"64","33.128331098","192.168.0.1","239.255.255.250","SSDP","312","NOTIFY * HTTP/1.1  "
"65","33.128333281","192.168.0.1","239.255.255.250","SSDP","367","NOTIFY * HTTP/1.1  "
"66","33.128335490","192.168.0.1","239.255.255.250","SSDP","377","NOTIFY * HTTP/1.1  "
"67","33.221463997","192.168.0.4","224.0.0.251","IGMPv2","60","Membership Report group 224.0.0.251"
"68","36.115300286","192.168.0.1","239.255.255.250","SSDP","307","NOTIFY * HTTP/1.1  "
"69","36.115736954","192.168.0.1","239.255.255.250","SSDP","316","NOTIFY * HTTP/1.1  "
"70","36.116328763","192.168.0.1","239.255.255.250","SSDP","379","NOTIFY * HTTP/1.1  "
"71","36.117161278","192.168.0.1","239.255.255.250","SSDP","371","NOTIFY * HTTP/1.1  "
"72","36.117446325","192.168.0.1","239.255.255.250","SSDP","316","NOTIFY * HTTP/1.1  "
"73","36.118287735","192.168.0.1","239.255.255.250","SSDP","355","NOTIFY * HTTP/1.1  "
"74","36.118614579","192.168.0.1","239.255.255.250","SSDP","387","NOTIFY * HTTP/1.1  "
"75","36.119240119","192.168.0.1","239.255.255.250","SSDP","316","NOTIFY * HTTP/1.1  "
"76","36.119761158","192.168.0.1","239.255.255.250","SSDP","375","NOTIFY * HTTP/1.1  "
"77","36.120469657","192.168.0.1","239.255.255.250","SSDP","381","NOTIFY * HTTP/1.1  "
"78","36.121037411","192.168.0.1","239.255.255.250","SSDP","369","NOTIFY * HTTP/1.1  "
"79","36.121585834","192.168.0.1","239.255.255.250","SSDP","375","NOTIFY * HTTP/1.1  "
"80","36.122143286","192.168.0.1","239.255.255.250","SSDP","303","NOTIFY * HTTP/1.1  "
"81","36.122772877","192.168.0.1","239.255.255.250","SSDP","312","NOTIFY * HTTP/1.1  "
"82","36.123321137","192.168.0.1","239.255.255.250","SSDP","367","NOTIFY * HTTP/1.1  "
"83","36.124121355","192.168.0.1","239.255.255.250","SSDP","377","NOTIFY * HTTP/1.1  "
"84","36.723564993","192.168.0.4","224.0.0.252","IGMPv2","60","Membership Report group 224.0.0.252"
"85","40.418406794","80:56:f2:25:a0:91","ff:ff:ff:ff:ff:ff","ARP","60","Who has 192.168.0.1? Tell 192.168.0.4"
"86","40.420443313","6c:72:20:70:01:f8","80:56:f2:25:a0:91","ARP","60","192.168.0.1 is at 6c:72:20:70:01:f8"
"87","50.536998036","80:56:f2:25:a0:91","ff:ff:ff:ff:ff:ff","ARP","60","Who has 192.168.0.1? Tell 192.168.0.4"
"88","50.538987622","6c:72:20:70:01:f8","80:56:f2:25:a0:91","ARP","60","192.168.0.1 is at 6c:72:20:70:01:f8"
"89","55.813523479","192.168.0.8","103.44.156.10","DNS","78","Standard query 0x0f6f A cdn.hackerrank.com"
"90","55.813634237","192.168.0.8","8.8.8.8","DNS","78","Standard query 0x0f6f A cdn.hackerrank.com"
"91","55.813691961","192.168.0.8","8.8.8.8","DNS","78","Standard query 0xd6f8 AAAA cdn.hackerrank.com"
"92","55.924545450","8.8.8.8","192.168.0.8","DNS","119","Standard query response 0x0f6f A cdn.hackerrank.com CNAME origin-cdn.hackerrank.com A 54.175.190.37"
"93","55.996702382","8.8.8.8","192.168.0.8","DNS","181","Standard query response 0xd6f8 AAAA cdn.hackerrank.com CNAME origin-cdn.hackerrank.com SOA ns-431.awsdns-53.com"
"94","55.997507288","192.168.0.8","54.175.190.37","TCP","74","35660  >  80 [SYN] Seq=0 Win=29200 Len=0 MSS=1460 SACK_PERM=1 TSval=150664 TSecr=0 WS=128"
"95","56.003669771","54.175.190.37","192.168.0.8","TCP","60","80  >  35660 [SYN, ACK] Seq=0 Ack=1 Win=29200 Len=0 MSS=1360"
"96","56.003735017","192.168.0.8","54.175.190.37","TCP","54","35660  >  80 [ACK] Seq=1 Ack=1 Win=29200 Len=0"
"97","56.004150675","192.168.0.8","54.175.190.37","HTTP","236","GET /hackerrank/static/contests/capture-the-flag/infinite/qds.html HTTP/1.1 "
"98","56.014551703","54.175.190.37","192.168.0.8","TCP","60","80  >  35660 [ACK] Seq=1 Ack=183 Win=21760 Len=0"
"99","56.134135021","103.44.156.10","192.168.0.8","DNS","256","Standard query response 0x0f6f A cdn.hackerrank.com CNAME origin-cdn.hackerrank.com A 54.175.190.37 NS ns-525.awsdns-01.net NS ns-1314.awsdns-36.org NS ns-431.awsdns-53.com NS ns-1691.awsdns-19.co.uk"
"100","56.499937331","54.175.190.37","192.168.0.8","HTTP","617","HTTP/1.1 200 OK  (text/html)"
"101","56.500025915","54.175.190.37","192.168.0.8","TCP","60","80  >  35660 [FIN, ACK] Seq=564 Ack=183 Win=21760 Len=0"
"102","56.501399743","192.168.0.8","54.175.190.37","TCP","54","35660  >  80 [ACK] Seq=183 Ack=564 Win=29839 Len=0"
"103","56.502788441","192.168.0.8","54.175.190.37","TCP","54","35660  >  80 [FIN, ACK] Seq=183 Ack=565 Win=29839 Len=0"
"104","56.543597684","54.175.190.37","192.168.0.8","TCP","60","80  >  35660 [ACK] Seq=565 Ack=184 Win=21760 Len=0"
"105","56.571325785","192.168.0.8","8.8.8.8","DNS","78","Standard query 0x9475 A cdn.hackerrank.com"
"106","56.571595389","192.168.0.8","8.8.8.8","DNS","78","Standard query 0xbede AAAA cdn.hackerrank.com"
"107","56.609464738","8.8.8.8","192.168.0.8","DNS","119","Standard query response 0x9475 A cdn.hackerrank.com CNAME origin-cdn.hackerrank.com A 54.175.190.37"
"108","56.610020542","8.8.8.8","192.168.0.8","DNS","181","Standard query response 0xbede AAAA cdn.hackerrank.com CNAME origin-cdn.hackerrank.com SOA ns-431.awsdns-53.com"
"109","56.610525498","192.168.0.8","54.175.190.37","TCP","74","35662  >  80 [SYN] Seq=0 Win=29200 Len=0 MSS=1460 SACK_PERM=1 TSval=150817 TSecr=0 WS=128"
"110","56.628962987","54.175.190.37","192.168.0.8","TCP","60","80  >  35662 [SYN, ACK] Seq=0 Ack=1 Win=29200 Len=0 MSS=1360"
"111","56.629083915","192.168.0.8","54.175.190.37","TCP","54","35662  >  80 [ACK] Seq=1 Ack=1 Win=29200 Len=0"
"112","56.629246304","192.168.0.8","54.175.190.37","HTTP","238","GET /hackerrank/static/contests/capture-the-flag/infinite/flhxd.html HTTP/1.1 "
"113","56.629929751","54.175.190.37","192.168.0.8","TCP","60","80  >  35662 [ACK] Seq=1 Ack=185 Win=21760 Len=0"
"114","57.122496328","54.175.190.37","192.168.0.8","HTTP","591","HTTP/1.1 200 OK  (text/html)"
"115","57.122609447","54.175.190.37","192.168.0.8","TCP","60","80  >  35662 [FIN, ACK] Seq=538 Ack=185 Win=21760 Len=0"
"116","57.122751590","192.168.0.8","54.175.190.37","TCP","54","35662  >  80 [ACK] Seq=185 Ack=538 Win=30072 Len=0"
"117","57.124393187","192.168.0.8","54.175.190.37","TCP","54","35662  >  80 [FIN, ACK] Seq=185 Ack=539 Win=30072 Len=0"
"118","57.129267084","54.175.190.37","192.168.0.8","TCP","60","80  >  35662 [ACK] Seq=539 Ack=186 Win=21760 Len=0"
"119","57.138665622","192.168.0.8","8.8.8.8","DNS","78","Standard query 0xb524 A cdn.hackerrank.com"
"120","57.138896672","192.168.0.8","8.8.8.8","DNS","78","Standard query 0x60dd AAAA cdn.hackerrank.com"
"121","57.194121866","8.8.8.8","192.168.0.8","DNS","119","Standard query response 0xb524 A cdn.hackerrank.com CNAME origin-cdn.hackerrank.com A 54.175.190.37"
"122","57.194201155","8.8.8.8","192.168.0.8","DNS","181","Standard query response 0x60dd AAAA cdn.hackerrank.com CNAME origin-cdn.hackerrank.com SOA ns-431.awsdns-53.com"
"123","57.195208254","192.168.0.8","54.175.190.37","TCP","74","35664  >  80 [SYN] Seq=0 Win=29200 Len=0 MSS=1460 SACK_PERM=1 TSval=150963 TSecr=0 WS=128"
"124","57.200331176","54.175.190.37","192.168.0.8","TCP","60","80  >  35664 [SYN, ACK] Seq=0 Ack=1 Win=29200 Len=0 MSS=1360"
"125","57.200441894","192.168.0.8","54.175.190.37","TCP","54","35664  >  80 [ACK] Seq=1 Ack=1 Win=29200 Len=0"
"126","57.200631883","192.168.0.8","54.175.190.37","HTTP","238","GET /hackerrank/static/contests/capture-the-flag/infinite/eesjd.html HTTP/1.1 "
"127","57.201055114","54.175.190.37","192.168.0.8","TCP","60","80  >  35664 [ACK] Seq=1 Ack=185 Win=21760 Len=0"
"128","57.705126539","54.175.190.37","192.168.0.8","HTTP","527","HTTP/1.1 200 OK  (text/html)"
"129","57.705318229","192.168.0.8","54.175.190.37","TCP","54","35664  >  80 [ACK] Seq=185 Ack=474 Win=30016 Len=0"
"130","57.705447387","54.175.190.37","192.168.0.8","TCP","60","80  >  35664 [FIN, ACK] Seq=474 Ack=185 Win=21760 Len=0"
"131","57.706438159","192.168.0.8","54.175.190.37","TCP","54","35664  >  80 [FIN, ACK] Seq=185 Ack=475 Win=30016 Len=0"
"132","57.713616139","54.175.190.37","192.168.0.8","TCP","60","80  >  35664 [ACK] Seq=475 Ack=186 Win=21760 Len=0"
"133","57.720743024","192.168.0.8","8.8.8.8","DNS","78","Standard query 0x0090 A cdn.hackerrank.com"
"134","57.721216673","192.168.0.8","8.8.8.8","DNS","78","Standard query 0x7626 AAAA cdn.hackerrank.com"
"135","57.758590645","8.8.8.8","192.168.0.8","DNS","119","Standard query response 0x0090 A cdn.hackerrank.com CNAME origin-cdn.hackerrank.com A 54.175.190.37"
"136","57.762106847","8.8.8.8","192.168.0.8","DNS","181","Standard query response 0x7626 AAAA cdn.hackerrank.com CNAME origin-cdn.hackerrank.com SOA ns-431.awsdns-53.com"
"137","57.762545528","192.168.0.8","54.175.190.37","TCP","74","35666  >  80 [SYN] Seq=0 Win=29200 Len=0 MSS=1460 SACK_PERM=1 TSval=151105 TSecr=0 WS=128"
"138","57.766889615","54.175.190.37","192.168.0.8","TCP","60","80  >  35666 [SYN, ACK] Seq=0 Ack=1 Win=29200 Len=0 MSS=1360"
"139","57.766995501","192.168.0.8","54.175.190.37","TCP","54","35666  >  80 [ACK] Seq=1 Ack=1 Win=29200 Len=0"
"140","57.767334710","192.168.0.8","54.175.190.37","HTTP","239","GET /hackerrank/static/contests/capture-the-flag/infinite/auspzk.html HTTP/1.1 "
"141","57.767596116","54.175.190.37","192.168.0.8","TCP","60","80  >  35666 [ACK] Seq=1 Ack=186 Win=21760 Len=0"
"142","58.261405020","54.175.190.37","192.168.0.8","HTTP","592","HTTP/1.1 200 OK  (text/html)"
"143","58.261530007","54.175.190.37","192.168.0.8","TCP","60","80  >  35666 [FIN, ACK] Seq=539 Ack=186 Win=21760 Len=0"
"144","58.261671310","192.168.0.8","54.175.190.37","TCP","54","35666  >  80 [ACK] Seq=186 Ack=539 Win=30128 Len=0"
"145","58.262717145","192.168.0.8","54.175.190.37","TCP","54","35666  >  80 [FIN, ACK] Seq=186 Ack=540 Win=30128 Len=0"
"146","58.268771123","54.175.190.37","192.168.0.8","TCP","60","80  >  35666 [ACK] Seq=540 Ack=187 Win=21760 Len=0"
"147","58.273761349","192.168.0.8","8.8.8.8","DNS","78","Standard query 0x3e1d A cdn.hackerrank.com"
"148","58.273986525","192.168.0.8","8.8.8.8","DNS","78","Standard query 0xb6bc AAAA cdn.hackerrank.com"
"149","58.311634616","8.8.8.8","192.168.0.8","DNS","119","Standard query response 0x3e1d A cdn.hackerrank.com CNAME origin-cdn.hackerrank.com A 54.175.190.37"
"150","58.311986828","8.8.8.8","192.168.0.8","DNS","181","Standard query response 0xb6bc AAAA cdn.hackerrank.com CNAME origin-cdn.hackerrank.com SOA ns-431.awsdns-53.com"
"151","58.312360712","192.168.0.8","54.175.190.37","TCP","74","35668  >  80 [SYN] Seq=0 Win=29200 Len=0 MSS=1460 SACK_PERM=1 TSval=151242 TSecr=0 WS=128"
"152","58.317101259","54.175.190.37","192.168.0.8","TCP","60","80  >  35668 [SYN, ACK] Seq=0 Ack=1 Win=29200 Len=0 MSS=1360"
"153","58.317164342","192.168.0.8","54.175.190.37","TCP","54","35668  >  80 [ACK] Seq=1 Ack=1 Win=29200 Len=0"
"154","58.317566842","192.168.0.8","54.175.190.37","HTTP","239","GET /hackerrank/static/contests/capture-the-flag/infinite/oipauj.html HTTP/1.1 "
"155","58.317969513","54.175.190.37","192.168.0.8","TCP","60","80  >  35668 [ACK] Seq=1 Ack=186 Win=21760 Len=0"
"156","58.846153425","54.175.190.37","192.168.0.8","HTTP","559","HTTP/1.1 200 OK  (text/html)"
"157","58.846364458","192.168.0.8","54.175.190.37","TCP","54","35668  >  80 [ACK] Seq=186 Ack=506 Win=30016 Len=0"
"158","58.846502231","54.175.190.37","192.168.0.8","TCP","60","80  >  35668 [FIN, ACK] Seq=506 Ack=186 Win=21760 Len=0"
"159","58.847476198","192.168.0.8","54.175.190.37","TCP","54","35668  >  80 [FIN, ACK] Seq=186 Ack=507 Win=30016 Len=0"
"160","58.852677933","54.175.190.37","192.168.0.8","TCP","60","80  >  35668 [ACK] Seq=507 Ack=187 Win=21760 Len=0"
"161","58.857875502","192.168.0.8","8.8.8.8","DNS","78","Standard query 0x95ba A cdn.hackerrank.com"
"162","58.857969577","192.168.0.8","8.8.8.8","DNS","78","Standard query 0x1665 AAAA cdn.hackerrank.com"
"163","58.895922614","8.8.8.8","192.168.0.8","DNS","119","Standard query response 0x95ba A cdn.hackerrank.com CNAME origin-cdn.hackerrank.com A 54.175.190.37"
"164","58.902166203","8.8.8.8","192.168.0.8","DNS","181","Standard query response 0x1665 AAAA cdn.hackerrank.com CNAME origin-cdn.hackerrank.com SOA ns-431.awsdns-53.com"
"165","58.902800803","192.168.0.8","54.175.190.37","TCP","74","35670  >  80 [SYN] Seq=0 Win=29200 Len=0 MSS=1460 SACK_PERM=1 TSval=151390 TSecr=0 WS=128"
"166","58.907519122","54.175.190.37","192.168.0.8","TCP","60","80  >  35670 [SYN, ACK] Seq=0 Ack=1 Win=29200 Len=0 MSS=1360"
"167","58.907669104","192.168.0.8","54.175.190.37","TCP","54","35670  >  80 [ACK] Seq=1 Ack=1 Win=29200 Len=0"
"168","58.907911751","192.168.0.8","54.175.190.37","HTTP","236","GET /hackerrank/static/contests/capture-the-flag/infinite/mcx.html HTTP/1.1 "
"169","58.908319818","54.175.190.37","192.168.0.8","TCP","60","80  >  35670 [ACK] Seq=1 Ack=183 Win=21760 Len=0"
"170","59.401998838","54.175.190.37","192.168.0.8","HTTP","560","HTTP/1.1 200 OK  (text/html)"
"171","59.402184940","192.168.0.8","54.175.190.37","TCP","54","35670  >  80 [ACK] Seq=183 Ack=507 Win=30016 Len=0"
"172","59.402332719","54.175.190.37","192.168.0.8","TCP","60","80  >  35670 [FIN, ACK] Seq=507 Ack=183 Win=21760 Len=0"
"173","59.403460857","192.168.0.8","54.175.190.37","TCP","54","35670  >  80 [FIN, ACK] Seq=183 Ack=508 Win=30016 Len=0"
"174","59.411861532","54.175.190.37","192.168.0.8","TCP","60","80  >  35670 [ACK] Seq=508 Ack=184 Win=21760 Len=0"
"175","59.414055987","192.168.0.8","8.8.8.8","DNS","78","Standard query 0xca63 A cdn.hackerrank.com"
"176","59.414150819","192.168.0.8","8.8.8.8","DNS","78","Standard query 0x22d0 AAAA cdn.hackerrank.com"
"177","59.453471827","8.8.8.8","192.168.0.8","DNS","119","Standard query response 0xca63 A cdn.hackerrank.com CNAME origin-cdn.hackerrank.com A 54.175.190.37"
"178","59.453878769","8.8.8.8","192.168.0.8","DNS","181","Standard query response 0x22d0 AAAA cdn.hackerrank.com CNAME origin-cdn.hackerrank.com SOA ns-431.awsdns-53.com"
"179","59.454632539","192.168.0.8","54.175.190.37","TCP","74","35672  >  80 [SYN] Seq=0 Win=29200 Len=0 MSS=1460 SACK_PERM=1 TSval=151528 TSecr=0 WS=128"
"180","59.467338222","54.175.190.37","192.168.0.8","TCP","60","80  >  35672 [SYN, ACK] Seq=0 Ack=1 Win=29200 Len=0 MSS=1360"
"181","59.467399384","192.168.0.8","54.175.190.37","TCP","54","35672  >  80 [ACK] Seq=1 Ack=1 Win=29200 Len=0"
"182","59.467976172","192.168.0.8","54.175.190.37","HTTP","236","GET /hackerrank/static/contests/capture-the-flag/infinite/tds.html HTTP/1.1 "
"183","59.469240914","54.175.190.37","192.168.0.8","TCP","60","80  >  35672 [ACK] Seq=1 Ack=183 Win=21760 Len=0"
"184","59.942289945","54.175.190.37","192.168.0.8","HTTP","650","HTTP/1.1 200 OK  (text/html)"
"185","59.942473862","192.168.0.8","54.175.190.37","TCP","54","35672  >  80 [ACK] Seq=183 Ack=597 Win=29800 Len=0"
"186","59.942615228","54.175.190.37","192.168.0.8","TCP","60","80  >  35672 [FIN, ACK] Seq=597 Ack=183 Win=21760 Len=0"
"187","59.943634474","192.168.0.8","54.175.190.37","TCP","54","35672  >  80 [FIN, ACK] Seq=183 Ack=598 Win=29800 Len=0"
"188","59.948708092","54.175.190.37","192.168.0.8","TCP","60","80  >  35672 [ACK] Seq=598 Ack=184 Win=21760 Len=0"
"189","59.958336157","192.168.0.8","8.8.8.8","DNS","78","Standard query 0x928c A cdn.hackerrank.com"
"190","59.958486984","192.168.0.8","8.8.8.8","DNS","78","Standard query 0xf9d0 AAAA cdn.hackerrank.com"
"191","60.008954479","8.8.8.8","192.168.0.8","DNS","119","Standard query response 0x928c A cdn.hackerrank.com CNAME origin-cdn.hackerrank.com A 54.175.190.37"
"192","60.019930142","8.8.8.8","192.168.0.8","DNS","181","Standard query response 0xf9d0 AAAA cdn.hackerrank.com CNAME origin-cdn.hackerrank.com SOA ns-431.awsdns-53.com"
"193","60.021252151","192.168.0.8","54.175.190.37","TCP","74","35674  >  80 [SYN] Seq=0 Win=29200 Len=0 MSS=1460 SACK_PERM=1 TSval=151669 TSecr=0 WS=128"
"194","60.027931171","54.175.190.37","192.168.0.8","TCP","60","80  >  35674 [SYN, ACK] Seq=0 Ack=1 Win=29200 Len=0 MSS=1360"
"195","60.028032600","192.168.0.8","54.175.190.37","TCP","54","35674  >  80 [ACK] Seq=1 Ack=1 Win=29200 Len=0"
"196","60.028847402","192.168.0.8","54.175.190.37","HTTP","238","GET /hackerrank/static/contests/capture-the-flag/infinite/cvehb.html HTTP/1.1 "
"197","60.030173528","54.175.190.37","192.168.0.8","TCP","60","80  >  35674 [ACK] Seq=1 Ack=185 Win=21760 Len=0"
"198","60.523652770","54.175.190.37","192.168.0.8","HTTP","523","HTTP/1.1 200 OK  (text/html)"
"199","60.523928655","54.175.190.37","192.168.0.8","TCP","60","80  >  35674 [FIN, ACK] Seq=470 Ack=185 Win=21760 Len=0"
"200","60.523971100","192.168.0.8","54.175.190.37","TCP","54","35674  >  80 [ACK] Seq=185 Ack=470 Win=30016 Len=0"
"201","60.525352769","192.168.0.8","54.175.190.37","TCP","54","35674  >  80 [FIN, ACK] Seq=185 Ack=471 Win=30016 Len=0"
"202","60.536456092","54.175.190.37","192.168.0.8","TCP","60","80  >  35674 [ACK] Seq=471 Ack=186 Win=21760 Len=0"
"203","60.541342191","192.168.0.8","8.8.8.8","DNS","78","Standard query 0x8a46 A cdn.hackerrank.com"
"204","60.541573502","192.168.0.8","8.8.8.8","DNS","78","Standard query 0x3a5f AAAA cdn.hackerrank.com"
"205","60.591168718","8.8.8.8","192.168.0.8","DNS","119","Standard query response 0x8a46 A cdn.hackerrank.com CNAME origin-cdn.hackerrank.com A 54.175.190.37"
"206","60.591200760","8.8.8.8","192.168.0.8","DNS","181","Standard query response 0x3a5f AAAA cdn.hackerrank.com CNAME origin-cdn.hackerrank.com SOA ns-431.awsdns-53.com"
"207","60.591991500","192.168.0.8","54.175.190.37","TCP","74","35676  >  80 [SYN] Seq=0 Win=29200 Len=0 MSS=1460 SACK_PERM=1 TSval=151812 TSecr=0 WS=128"
"208","60.597209074","54.175.190.37","192.168.0.8","TCP","60","80  >  35676 [SYN, ACK] Seq=0 Ack=1 Win=29200 Len=0 MSS=1360"
"209","60.597270391","192.168.0.8","54.175.190.37","TCP","54","35676  >  80 [ACK] Seq=1 Ack=1 Win=29200 Len=0"
"210","60.597805994","192.168.0.8","54.175.190.37","HTTP","237","GET /hackerrank/static/contests/capture-the-flag/infinite/sevt.html HTTP/1.1 "
"211","60.598227787","54.175.190.37","192.168.0.8","TCP","60","80  >  35676 [ACK] Seq=1 Ack=184 Win=21760 Len=0"
"212","60.724490718","80:56:f2:25:a0:91","ff:ff:ff:ff:ff:ff","ARP","60","Who has 192.168.0.1? Tell 192.168.0.4"
"213","60.727268160","6c:72:20:70:01:f8","80:56:f2:25:a0:91","ARP","60","192.168.0.1 is at 6c:72:20:70:01:f8"
"214","61.126683489","54.175.190.37","192.168.0.8","HTTP","584","HTTP/1.1 200 OK  (text/html)"
"215","61.126849634","192.168.0.8","54.175.190.37","TCP","54","35676  >  80 [ACK] Seq=184 Ack=531 Win=30016 Len=0"
"216","61.129285740","54.175.190.37","192.168.0.8","TCP","60","80  >  35676 [FIN, ACK] Seq=531 Ack=184 Win=21760 Len=0"
"217","61.130072803","192.168.0.8","54.175.190.37","TCP","54","35676  >  80 [FIN, ACK] Seq=184 Ack=532 Win=30016 Len=0"
"218","61.160162266","192.168.0.8","8.8.8.8","DNS","78","Standard query 0x1f5c A cdn.hackerrank.com"
"219","61.160194828","54.175.190.37","192.168.0.8","TCP","60","80  >  35676 [ACK] Seq=532 Ack=185 Win=21760 Len=0"
"220","61.166091408","192.168.0.8","8.8.8.8","DNS","78","Standard query 0x6098 AAAA cdn.hackerrank.com"
"221","61.197834303","8.8.8.8","192.168.0.8","DNS","119","Standard query response 0x1f5c A cdn.hackerrank.com CNAME origin-cdn.hackerrank.com A 54.175.190.37"
"222","61.209799213","8.8.8.8","192.168.0.8","DNS","181","Standard query response 0x6098 AAAA cdn.hackerrank.com CNAME origin-cdn.hackerrank.com SOA ns-431.awsdns-53.com"
"223","61.210658218","192.168.0.8","54.175.190.37","TCP","74","35678  >  80 [SYN] Seq=0 Win=29200 Len=0 MSS=1460 SACK_PERM=1 TSval=151967 TSecr=0 WS=128"
"224","61.239392695","54.175.190.37","192.168.0.8","TCP","60","80  >  35678 [SYN, ACK] Seq=0 Ack=1 Win=29200 Len=0 MSS=1360"
"225","61.239456233","192.168.0.8","54.175.190.37","TCP","54","35678  >  80 [ACK] Seq=1 Ack=1 Win=29200 Len=0"
"226","61.239757648","192.168.0.8","54.175.190.37","HTTP","238","GET /hackerrank/static/contests/capture-the-flag/infinite/pkaza.html HTTP/1.1 "
"227","61.240214296","54.175.190.37","192.168.0.8","TCP","60","80  >  35678 [ACK] Seq=1 Ack=185 Win=21760 Len=0"
"228","61.751836954","54.175.190.37","192.168.0.8","HTTP","599","HTTP/1.1 200 OK  (text/html)"
"229","61.752106439","192.168.0.8","54.175.190.37","TCP","54","35678  >  80 [ACK] Seq=185 Ack=546 Win=29975 Len=0"
"230","61.752235929","54.175.190.37","192.168.0.8","TCP","60","80  >  35678 [FIN, ACK] Seq=546 Ack=185 Win=21760 Len=0"
"231","61.753370453","192.168.0.8","54.175.190.37","TCP","54","35678  >  80 [FIN, ACK] Seq=185 Ack=547 Win=29975 Len=0"
"232","61.758760492","54.175.190.37","192.168.0.8","TCP","60","80  >  35678 [ACK] Seq=547 Ack=186 Win=21760 Len=0"
"233","61.766155240","192.168.0.8","8.8.8.8","DNS","78","Standard query 0x7262 A cdn.hackerrank.com"
"234","61.766254300","192.168.0.8","8.8.8.8","DNS","78","Standard query 0xc3c8 AAAA cdn.hackerrank.com"
"235","61.804846548","8.8.8.8","192.168.0.8","DNS","119","Standard query response 0x7262 A cdn.hackerrank.com CNAME origin-cdn.hackerrank.com A 54.175.190.37"
"236","61.805455379","8.8.8.8","192.168.0.8","DNS","181","Standard query response 0xc3c8 AAAA cdn.hackerrank.com CNAME origin-cdn.hackerrank.com SOA ns-431.awsdns-53.com"
"237","61.806017573","192.168.0.8","54.175.190.37","TCP","74","35680  >  80 [SYN] Seq=0 Win=29200 Len=0 MSS=1460 SACK_PERM=1 TSval=152116 TSecr=0 WS=128"
"238","61.810358275","54.175.190.37","192.168.0.8","TCP","60","80  >  35680 [SYN, ACK] Seq=0 Ack=1 Win=29200 Len=0 MSS=1360"
"239","61.810424896","192.168.0.8","54.175.190.37","TCP","54","35680  >  80 [ACK] Seq=1 Ack=1 Win=29200 Len=0"
"240","61.810845309","192.168.0.8","54.175.190.37","HTTP","236","GET /hackerrank/static/contests/capture-the-flag/infinite/nsj.html HTTP/1.1 "
"241","61.811268782","54.175.190.37","192.168.0.8","TCP","60","80  >  35680 [ACK] Seq=1 Ack=183 Win=21760 Len=0"
"242","62.435380759","54.175.190.37","192.168.0.8","HTTP","654","HTTP/1.1 200 OK  (text/html)"
"243","62.435412720","54.175.190.37","192.168.0.8","TCP","60","80  >  35680 [FIN, ACK] Seq=601 Ack=183 Win=21760 Len=0"
"244","62.435567669","192.168.0.8","54.175.190.37","TCP","54","35680  >  80 [ACK] Seq=183 Ack=601 Win=30000 Len=0"
"245","62.436644172","192.168.0.8","54.175.190.37","TCP","54","35680  >  80 [FIN, ACK] Seq=183 Ack=602 Win=30000 Len=0"
"246","62.441978941","54.175.190.37","192.168.0.8","TCP","60","80  >  35680 [ACK] Seq=602 Ack=184 Win=21760 Len=0"
"247","62.449728519","192.168.0.8","8.8.8.8","DNS","78","Standard query 0x470c A cdn.hackerrank.com"
"248","62.449829433","192.168.0.8","8.8.8.8","DNS","78","Standard query 0xca7f AAAA cdn.hackerrank.com"
"249","62.489579385","8.8.8.8","192.168.0.8","DNS","119","Standard query response 0x470c A cdn.hackerrank.com CNAME origin-cdn.hackerrank.com A 54.175.190.37"
"250","62.489613796","8.8.8.8","192.168.0.8","DNS","181","Standard query response 0xca7f AAAA cdn.hackerrank.com CNAME origin-cdn.hackerrank.com SOA ns-431.awsdns-53.com"
"251","62.490603278","192.168.0.8","54.175.190.37","TCP","74","35682  >  80 [SYN] Seq=0 Win=29200 Len=0 MSS=1460 SACK_PERM=1 TSval=152287 TSecr=0 WS=128"
"252","62.495111974","54.175.190.37","192.168.0.8","TCP","60","80  >  35682 [SYN, ACK] Seq=0 Ack=1 Win=29200 Len=0 MSS=1360"
"253","62.495251428","192.168.0.8","54.175.190.37","TCP","54","35682  >  80 [ACK] Seq=1 Ack=1 Win=29200 Len=0"
"254","62.497644332","192.168.0.8","54.175.190.37","HTTP","240","GET /hackerrank/static/contests/capture-the-flag/infinite/kpsgbkt.html HTTP/1.1 "
"255","62.501599931","54.175.190.37","192.168.0.8","TCP","60","80  >  35682 [ACK] Seq=1 Ack=187 Win=21760 Len=0"
"256","63.027320263","54.175.190.37","192.168.0.8","HTTP","562","HTTP/1.1 200 OK  (text/html)"
"257","63.027678968","192.168.0.8","54.175.190.37","TCP","54","35682  >  80 [ACK] Seq=187 Ack=509 Win=30016 Len=0"
"258","63.029268204","192.168.0.8","54.175.190.37","TCP","54","35682  >  80 [FIN, ACK] Seq=187 Ack=509 Win=30016 Len=0"
"259","63.032972921","54.175.190.37","192.168.0.8","TCP","60","80  >  35682 [FIN, ACK] Seq=509 Ack=187 Win=21760 Len=0"
"260","63.033010785","192.168.0.8","54.175.190.37","TCP","54","35682  >  80 [ACK] Seq=188 Ack=510 Win=30016 Len=0"
"261","63.042335982","192.168.0.8","8.8.8.8","DNS","78","Standard query 0x9152 A cdn.hackerrank.com"
"262","63.042438332","192.168.0.8","8.8.8.8","DNS","78","Standard query 0x8af2 AAAA cdn.hackerrank.com"
"263","63.045098717","54.175.190.37","192.168.0.8","TCP","60","80  >  35682 [ACK] Seq=510 Ack=188 Win=21760 Len=0"
"264","63.088782736","8.8.8.8","192.168.0.8","DNS","119","Standard query response 0x9152 A cdn.hackerrank.com CNAME origin-cdn.hackerrank.com A 54.175.190.37"
"265","63.089387524","8.8.8.8","192.168.0.8","DNS","181","Standard query response 0x8af2 AAAA cdn.hackerrank.com CNAME origin-cdn.hackerrank.com SOA ns-431.awsdns-53.com"
"266","63.089814591","192.168.0.8","54.175.190.37","TCP","74","35684  >  80 [SYN] Seq=0 Win=29200 Len=0 MSS=1460 SACK_PERM=1 TSval=152437 TSecr=0 WS=128"
"267","63.094481021","54.175.190.37","192.168.0.8","TCP","60","80  >  35684 [SYN, ACK] Seq=0 Ack=1 Win=29200 Len=0 MSS=1360"
"268","63.094544043","192.168.0.8","54.175.190.37","TCP","54","35684  >  80 [ACK] Seq=1 Ack=1 Win=29200 Len=0"
"269","63.094930471","192.168.0.8","54.175.190.37","HTTP","240","GET /hackerrank/static/contests/capture-the-flag/infinite/kaypuar.html HTTP/1.1 "
"270","63.095191612","54.175.190.37","192.168.0.8","TCP","60","80  >  35684 [ACK] Seq=1 Ack=187 Win=21760 Len=0"
"271","63.632579242","54.175.190.37","192.168.0.8","HTTP","529","HTTP/1.1 200 OK  (text/html)"
"272","63.632656800","54.175.190.37","192.168.0.8","TCP","60","80  >  35684 [FIN, ACK] Seq=476 Ack=187 Win=21760 Len=0"
"273","63.632841069","192.168.0.8","54.175.190.37","TCP","54","35684  >  80 [ACK] Seq=187 Ack=476 Win=30016 Len=0"
"274","63.634267643","192.168.0.8","54.175.190.37","TCP","54","35684  >  80 [FIN, ACK] Seq=187 Ack=477 Win=30016 Len=0"
"275","63.639197187","54.175.190.37","192.168.0.8","TCP","60","80  >  35684 [ACK] Seq=477 Ack=188 Win=21760 Len=0"
"276","63.646410840","192.168.0.8","8.8.8.8","DNS","78","Standard query 0x700c A cdn.hackerrank.com"
"277","63.646507631","192.168.0.8","8.8.8.8","DNS","78","Standard query 0x5048 AAAA cdn.hackerrank.com"
"278","63.688165245","8.8.8.8","192.168.0.8","DNS","119","Standard query response 0x700c A cdn.hackerrank.com CNAME origin-cdn.hackerrank.com A 54.175.190.37"
"279","63.688204352","8.8.8.8","192.168.0.8","DNS","181","Standard query response 0x5048 AAAA cdn.hackerrank.com CNAME origin-cdn.hackerrank.com SOA ns-431.awsdns-53.com"
"280","63.688889177","192.168.0.8","54.175.190.37","TCP","74","35686  >  80 [SYN] Seq=0 Win=29200 Len=0 MSS=1460 SACK_PERM=1 TSval=152587 TSecr=0 WS=128"
"281","63.701594861","54.175.190.37","192.168.0.8","TCP","60","80  >  35686 [SYN, ACK] Seq=0 Ack=1 Win=29200 Len=0 MSS=1360"
"282","63.701710320","192.168.0.8","54.175.190.37","TCP","54","35686  >  80 [ACK] Seq=1 Ack=1 Win=29200 Len=0"
"283","63.702247670","192.168.0.8","54.175.190.37","HTTP","240","GET /hackerrank/static/contests/capture-the-flag/infinite/zsuqwbi.html HTTP/1.1 "
"284","63.702615758","54.175.190.37","192.168.0.8","TCP","60","80  >  35686 [ACK] Seq=1 Ack=187 Win=21760 Len=0"
"285","64.246375023","54.175.190.37","192.168.0.8","HTTP","593","HTTP/1.1 200 OK  (text/html)"
"286","64.246715548","192.168.0.8","54.175.190.37","TCP","54","35686  >  80 [ACK] Seq=187 Ack=540 Win=30184 Len=0"
"287","64.246992359","54.175.190.37","192.168.0.8","TCP","60","80  >  35686 [FIN, ACK] Seq=540 Ack=187 Win=21760 Len=0"
"288","64.248001360","192.168.0.8","54.175.190.37","TCP","54","35686  >  80 [FIN, ACK] Seq=187 Ack=541 Win=30184 Len=0"
"289","64.253664177","54.175.190.37","192.168.0.8","TCP","60","80  >  35686 [ACK] Seq=541 Ack=188 Win=21760 Len=0"
"290","64.266566206","192.168.0.8","8.8.8.8","DNS","78","Standard query 0x1260 A cdn.hackerrank.com"
"291","64.266673695","192.168.0.8","8.8.8.8","DNS","78","Standard query 0xb39d AAAA cdn.hackerrank.com"
"292","64.305912845","8.8.8.8","192.168.0.8","DNS","119","Standard query response 0x1260 A cdn.hackerrank.com CNAME origin-cdn.hackerrank.com A 54.175.190.37"
"293","64.305949657","8.8.8.8","192.168.0.8","DNS","181","Standard query response 0xb39d AAAA cdn.hackerrank.com CNAME origin-cdn.hackerrank.com SOA ns-431.awsdns-53.com"
"294","64.306556812","192.168.0.8","54.175.190.37","TCP","74","35688  >  80 [SYN] Seq=0 Win=29200 Len=0 MSS=1460 SACK_PERM=1 TSval=152741 TSecr=0 WS=128"
"295","64.310972367","54.175.190.37","192.168.0.8","TCP","60","80  >  35688 [SYN, ACK] Seq=0 Ack=1 Win=29200 Len=0 MSS=1360"
"296","64.311037780","192.168.0.8","54.175.190.37","TCP","54","35688  >  80 [ACK] Seq=1 Ack=1 Win=29200 Len=0"
"297","64.311416541","192.168.0.8","54.175.190.37","HTTP","238","GET /hackerrank/static/contests/capture-the-flag/infinite/mtoiz.html HTTP/1.1 "
"298","64.311964323","54.175.190.37","192.168.0.8","TCP","60","80  >  35688 [ACK] Seq=1 Ack=185 Win=21760 Len=0"
"299","64.787287504","54.175.190.37","192.168.0.8","HTTP","523","HTTP/1.1 200 OK  (text/html)"
"300","64.787448513","192.168.0.8","54.175.190.37","TCP","54","35688  >  80 [ACK] Seq=185 Ack=470 Win=30016 Len=0"
"301","64.787591075","54.175.190.37","192.168.0.8","TCP","60","80  >  35688 [FIN, ACK] Seq=470 Ack=185 Win=21760 Len=0"
"302","64.788566190","192.168.0.8","54.175.190.37","TCP","54","35688  >  80 [FIN, ACK] Seq=185 Ack=471 Win=30016 Len=0"
"303","64.794760361","54.175.190.37","192.168.0.8","TCP","60","80  >  35688 [ACK] Seq=471 Ack=186 Win=21760 Len=0"
"304","64.798275732","192.168.0.8","8.8.8.8","DNS","78","Standard query 0x0ae5 A cdn.hackerrank.com"
"305","64.798368806","192.168.0.8","8.8.8.8","DNS","78","Standard query 0xa32f AAAA cdn.hackerrank.com"
"306","64.836375615","8.8.8.8","192.168.0.8","DNS","119","Standard query response 0x0ae5 A cdn.hackerrank.com CNAME origin-cdn.hackerrank.com A 54.175.190.37"
"307","64.836884866","8.8.8.8","192.168.0.8","DNS","181","Standard query response 0xa32f AAAA cdn.hackerrank.com CNAME origin-cdn.hackerrank.com SOA ns-431.awsdns-53.com"
"308","64.837617173","192.168.0.8","54.175.190.37","TCP","74","35690  >  80 [SYN] Seq=0 Win=29200 Len=0 MSS=1460 SACK_PERM=1 TSval=152874 TSecr=0 WS=128"
"309","64.842335708","54.175.190.37","192.168.0.8","TCP","60","80  >  35690 [SYN, ACK] Seq=0 Ack=1 Win=29200 Len=0 MSS=1360"
"310","64.842399440","192.168.0.8","54.175.190.37","TCP","54","35690  >  80 [ACK] Seq=1 Ack=1 Win=29200 Len=0"
"311","64.842926622","192.168.0.8","54.175.190.37","HTTP","238","GET /hackerrank/static/contests/capture-the-flag/infinite/gatft.html HTTP/1.1 "
"312","64.843150809","54.175.190.37","192.168.0.8","TCP","60","80  >  35690 [ACK] Seq=1 Ack=185 Win=21760 Len=0"
"313","65.344569438","54.175.190.37","192.168.0.8","HTTP","694","HTTP/1.1 200 OK  (text/html)"
"314","65.344717223","192.168.0.8","54.175.190.37","TCP","54","35690  >  80 [ACK] Seq=185 Ack=641 Win=30080 Len=0"
"315","65.345953090","192.168.0.8","54.175.190.37","TCP","54","35690  >  80 [FIN, ACK] Seq=185 Ack=641 Win=30080 Len=0"
"316","65.347381154","54.175.190.37","192.168.0.8","TCP","60","80  >  35690 [FIN, ACK] Seq=641 Ack=185 Win=21760 Len=0"
"317","65.347400330","192.168.0.8","54.175.190.37","TCP","54","35690  >  80 [ACK] Seq=186 Ack=642 Win=30080 Len=0"
"318","65.350304171","54.175.190.37","192.168.0.8","TCP","60","80  >  35690 [ACK] Seq=642 Ack=186 Win=21760 Len=0"
"319","65.360617111","192.168.0.8","8.8.8.8","DNS","78","Standard query 0x1064 A cdn.hackerrank.com"
"320","65.360717544","192.168.0.8","8.8.8.8","DNS","78","Standard query 0xed5a AAAA cdn.hackerrank.com"
"321","65.398664315","8.8.8.8","192.168.0.8","DNS","119","Standard query response 0x1064 A cdn.hackerrank.com CNAME origin-cdn.hackerrank.com A 54.175.190.37"
"322","65.399155762","8.8.8.8","192.168.0.8","DNS","181","Standard query response 0xed5a AAAA cdn.hackerrank.com CNAME origin-cdn.hackerrank.com SOA ns-431.awsdns-53.com"
"323","65.399672956","192.168.0.8","54.175.190.37","TCP","74","35692  >  80 [SYN] Seq=0 Win=29200 Len=0 MSS=1460 SACK_PERM=1 TSval=153014 TSecr=0 WS=128"
"324","65.404122058","54.175.190.37","192.168.0.8","TCP","60","80  >  35692 [SYN, ACK] Seq=0 Ack=1 Win=29200 Len=0 MSS=1360"
"325","65.404183249","192.168.0.8","54.175.190.37","TCP","54","35692  >  80 [ACK] Seq=1 Ack=1 Win=29200 Len=0"
"326","65.404556185","192.168.0.8","54.175.190.37","HTTP","240","GET /hackerrank/static/contests/capture-the-flag/infinite/dywfnxj.html HTTP/1.1 "
"327","65.404736046","54.175.190.37","192.168.0.8","TCP","60","80  >  35692 [ACK] Seq=1 Ack=187 Win=21760 Len=0"
"328","65.890965084","54.175.190.37","192.168.0.8","HTTP","599","HTTP/1.1 200 OK  (text/html)"
"329","65.891203384","192.168.0.8","54.175.190.37","TCP","54","35692  >  80 [ACK] Seq=187 Ack=546 Win=29975 Len=0"
"330","65.892764817","192.168.0.8","54.175.190.37","TCP","54","35692  >  80 [FIN, ACK] Seq=187 Ack=546 Win=29975 Len=0"
"331","65.895611944","54.175.190.37","192.168.0.8","TCP","60","80  >  35692 [FIN, ACK] Seq=546 Ack=187 Win=21760 Len=0"
"332","65.895647164","192.168.0.8","54.175.190.37","TCP","54","35692  >  80 [ACK] Seq=188 Ack=547 Win=29975 Len=0"
"333","65.903132600","54.175.190.37","192.168.0.8","TCP","60","80  >  35692 [ACK] Seq=547 Ack=188 Win=21760 Len=0"
"334","65.906100687","192.168.0.8","8.8.8.8","DNS","78","Standard query 0x459a A cdn.hackerrank.com"
"335","65.906192349","192.168.0.8","8.8.8.8","DNS","78","Standard query 0xef13 AAAA cdn.hackerrank.com"
"336","65.953078385","8.8.8.8","192.168.0.8","DNS","119","Standard query response 0x459a A cdn.hackerrank.com CNAME origin-cdn.hackerrank.com A 54.175.190.37"
"337","65.953446452","8.8.8.8","192.168.0.8","DNS","181","Standard query response 0xef13 AAAA cdn.hackerrank.com CNAME origin-cdn.hackerrank.com SOA ns-431.awsdns-53.com"
"338","65.953843743","192.168.0.8","54.175.190.37","TCP","74","35694  >  80 [SYN] Seq=0 Win=29200 Len=0 MSS=1460 SACK_PERM=1 TSval=153153 TSecr=0 WS=128"
"339","65.962455387","54.175.190.37","192.168.0.8","TCP","60","80  >  35694 [SYN, ACK] Seq=0 Ack=1 Win=29200 Len=0 MSS=1360"
"340","65.962517842","192.168.0.8","54.175.190.37","TCP","54","35694  >  80 [ACK] Seq=1 Ack=1 Win=29200 Len=0"
"341","65.962830407","192.168.0.8","54.175.190.37","HTTP","237","GET /hackerrank/static/contests/capture-the-flag/infinite/nhho.html HTTP/1.1 "
